{
  "$schema": "https://json-schema.org/draft/2020-12/schema",
  "$id": "https://feinschliff.dev/schemas/tokens.schema.json",
  "title": "Brand tokens.json (Feinschliff DSL pipeline)",
  "description": "Validates a brand pack's tokens.json (DTCG-flavoured). The DSL pipeline (lib/dsl/tokens.py) requires `color`, `font-family`, and `font-size` groups; `font-weight` and `slide` have built-in defaults and are optional. Extra colors, sizes, and groups are allowed.",
  "type": "object",
  "required": ["color", "font-family", "font-size"],
  "properties": {
    "$schema": { "type": "string" },
    "$description": { "type": "string" },
    "color": {
      "type": "object",
      "minProperties": 1,
      "description": "Color tokens. Each entry is either a hex string or a DTCG object {\"$value\": \"#RRGGBB\"}.",
      "$comment": "Conventional color-key vocabulary (free-form via additionalProperties; documented here so brand authors share names across packs). Phase 4 added 6 semantic colors for C-suite layouts (recommendation, risk-register, risk-matrix, roadmap): `severity-low` / `severity-medium` / `severity-high` for the risk P×I axis, and `status-done` / `status-current` / `status-next` for roadmap-style progress states. Brands SHOULD use these exact names when they ship the corresponding semantic so layouts that reach for `tokens.color['severity-high']` resolve across packs. A brand MAY omit any of them — the layouts gracefully fall back to ramp colors when a key is absent.",
      "properties": {
        "$type": { "type": "string" },
        "$description": { "type": "string" }
      },
      "additionalProperties": {
        "oneOf": [
          { "type": "string" },
          {
            "type": "object",
            "required": ["$value"],
            "properties": {
              "$value": { "type": "string" },
              "$type": { "type": "string" },
              "$description": { "type": "string" }
            },
            "additionalProperties": false
          }
        ]
      }
    },
    "font-family": {
      "type": "object",
      "minProperties": 1,
      "description": "Font-family tokens. Each entry is either an array of family names or a DTCG object {\"$value\": [\"...\"]}.",
      "properties": {
        "$type": { "type": "string" },
        "$description": { "type": "string" }
      },
      "additionalProperties": {
        "oneOf": [
          { "type": "array", "items": { "type": "string" }, "minItems": 1 },
          {
            "type": "object",
            "required": ["$value"],
            "properties": {
              "$value": { "type": "array", "items": { "type": "string" }, "minItems": 1 },
              "$type": { "type": "string" },
              "$description": { "type": "string" }
            },
            "additionalProperties": false
          }
        ]
      }
    },
    "font-weight": {
      "type": "object",
      "description": "Optional font-weight tokens. Standard CSS weights (300..900) are used when omitted.",
      "properties": {
        "$type": { "type": "string" },
        "$description": { "type": "string" }
      },
      "additionalProperties": {
        "oneOf": [
          { "type": "integer", "minimum": 1, "maximum": 1000 },
          {
            "type": "object",
            "required": ["$value"],
            "properties": {
              "$value": { "type": "integer", "minimum": 1, "maximum": 1000 },
              "$type": { "type": "string" },
              "$description": { "type": "string" }
            },
            "additionalProperties": false
          }
        ]
      }
    },
    "font-size": {
      "type": "object",
      "minProperties": 1,
      "description": "Font-size tokens. Each value is a dimension string like \"160px\".",
      "properties": {
        "$type": { "type": "string" },
        "$description": { "type": "string" }
      },
      "additionalProperties": {
        "oneOf": [
          { "type": "string", "pattern": "^-?[0-9]+(\\.[0-9]+)?px$" },
          {
            "type": "object",
            "required": ["$value"],
            "properties": {
              "$value": { "type": "string", "pattern": "^-?[0-9]+(\\.[0-9]+)?px$" },
              "$type": { "type": "string" },
              "$description": { "type": "string" }
            },
            "additionalProperties": false
          }
        ]
      }
    },
    "slide": {
      "type": "object",
      "description": "Optional slide-canvas dimensions. Defaults to a 1920x1080 canvas with 100/100/80px padding when omitted.",
      "properties": {
        "$type": { "type": "string" },
        "$description": { "type": "string" }
      },
      "additionalProperties": {
        "oneOf": [
          { "type": "string", "pattern": "^-?[0-9]+(\\.[0-9]+)?px$" },
          {
            "type": "object",
            "required": ["$value"],
            "properties": {
              "$value": { "type": "string", "pattern": "^-?[0-9]+(\\.[0-9]+)?px$" },
              "$type": { "type": "string" },
              "$description": { "type": "string" }
            },
            "additionalProperties": false
          }
        ]
      }
    },
    "style": {
      "type": "object",
      "description": "Reserved for future per-brand style-bundle overrides (see STYLE_BUNDLES in lib/dsl/tokens.py)."
    },
    "asset_sources": {
      "type": "object",
      "description": "Reserved field for per-brand asset-source declarations. Accepted in tokens for forward compatibility; not consumed by the current v2 pipeline."
    },
    "typography": {
      "type": "object",
      "description": "Layer 1 typography tokens (display tracking curve, tabular numerals).",
      "additionalProperties": false,
      "properties": {
        "display_tracking_curve": {
          "type": "object",
          "description": "Map of font-size threshold (px, as string) → em-relative tracking (negative shrinks).",
          "patternProperties": { "^[0-9]+$": { "type": "number" } },
          "additionalProperties": false
        },
        "tnum_font": {
          "type": "string",
          "description": "Font face to swap to when a run's content is purely numeric (e.g. a 'Tabular' cut)."
        },
        "tnum_slot_keys": {
          "type": "array",
          "description": "Slot keys whose runs should always activate the tabular face regardless of content shape (Layer 2 consumer).",
          "items": { "type": "string" }
        }
      }
    },
    "picture_treatment": {
      "type": "string",
      "description": "Per-brand default photo treatment applied at picture-fill time.",
      "pattern": "^(none|desat\\(([0-9]*\\.?[0-9]+)\\)|duotone)$"
    },
    "locale": {
      "type": "string",
      "description": "Locale tag controlling quote conventions and language-aware text moves.",
      "enum": ["en", "de", "fr"]
    },
    "chart": {
      "type": "object",
      "description": "Chart-sanitation tokens consumed by Layer 2 chart layouts.",
      "additionalProperties": false,
      "properties": {
        "chrome": { "type": "string", "enum": ["minimal", "full"] },
        "axis_color_role": { "type": "string" },
        "legend_threshold": { "type": "integer", "minimum": 1 }
      }
    },
    "$image_provider": {
      "type": "object",
      "description": "Build-time image provider for picture primitives using query:. Lookup by `kind` against the global provider registry. `config` is passed through to the provider constructor.",
      "additionalProperties": false,
      "required": ["kind"],
      "properties": {
        "kind": { "type": "string" },
        "config": { "type": "object", "additionalProperties": true }
      }
    },
    "brief_defaults": {
      "type": "object",
      "description": "Optional brand-pack-level brief priors. When present, the deck orchestrator seeds brief inference with these defaults before applying explicit user flags or heuristics. Precedence: explicit flag > user-in-prompt > brand_defaults > heuristic. All sub-properties are optional.",
      "additionalProperties": false,
      "properties": {
        "verbosity": {
          "type": "string",
          "description": "Default verbosity tier for decks built with this brand. Matches the Verbosity Tier table in pipeline.md step 1.",
          "enum": ["concise", "standard", "text-heavy"]
        },
        "image_style": {
          "type": "string",
          "description": "Default image style for decks built with this brand. Matches the Image style heuristics table in pipeline.md step 1.",
          "enum": ["data-viz", "photorealistic", "illustration", "minimal", "abstract", "none"]
        },
        "frame": {
          "type": "string",
          "description": "Default narrative frame for decks built with this brand. Matches the narrative frame list in pipeline.md step 1.",
          "enum": ["scqa", "pssr", "sparkline", "man-in-a-hole", "abt", "ppf", "pse", "kea"]
        },
        "audience": {
          "type": "string",
          "description": "Default target audience for decks built with this brand. Matches audience-calibration.md.",
          "enum": ["exec", "manager", "developer", "peer"]
        }
      }
    }
  },
  "additionalProperties": true
}
