{
  "$schema": "https://schemas.designtokens.org/draft-2/format.json",
  "$description": "Catppuccin Macchiato \u2014 Medium-dark Catppuccin flavor between Frapp\u00e9 and Mocha \u2014 gentle contrast. Upstream catppuccin/palette (MIT).",
  "color": {
    "$type": "color",
    "accent": {
      "$value": "#C6A0F6",
      "$description": "Primary gold \u2014 the only accent. Use sparingly."
    },
    "accent-hover": {
      "$value": "#B7BDF8",
      "$description": "Pressed / printed gold."
    },
    "highlight": {
      "$value": "#F5BDE6",
      "$description": "Hover / on-dark accent gold."
    },
    "black": {
      "$value": "#24273A",
      "$description": "Navy-900 \u2014 deepest."
    },
    "ink": {
      "$value": "#CAD3F5",
      "$description": "Body text on dark \u2014 high contrast."
    },
    "chapter-slab": {
      "$value": "#181926",
      "$description": "Deepest contrast band (catppuccin mantle/crust) \u2014 chapter dividers."
    },
    "graphite": {
      "$value": "#A5ADCB",
      "$description": "Secondary text."
    },
    "steel": {
      "$value": "#939AB7",
      "$description": "Tertiary / muted labels."
    },
    "silver": {
      "$value": "#939AB7",
      "$description": "Muted text on dark / soft labels."
    },
    "fog": {
      "$value": "#363A4F",
      "$description": "Warm hairlines on light."
    },
    "paper": {
      "$value": "#24273A",
      "$description": "Warm paper \u2014 page on light."
    },
    "paper-2": {
      "$value": "#363A4F",
      "$description": "Raised surface on light."
    },
    "off-white": {
      "$value": "#CAD3F5",
      "$description": "Body text on dark."
    },
    "off-white-2": {
      "$value": "#A5ADCB",
      "$description": "Muted text on dark."
    },
    "rule-dark": {
      "$value": "#494D64",
      "$description": "Hairlines on dark."
    },
    "navy-800": {
      "$value": "#181926",
      "$description": "Surface on dark."
    },
    "navy-700": {
      "$value": "#1E2030",
      "$description": "Raised surface on dark."
    },
    "navy-600": {
      "$value": "#363A4F",
      "$description": "Gem mid-facet."
    },
    "navy-500": {
      "$value": "#494D64",
      "$description": "Gem upper-facet."
    },
    "navy-400": {
      "$value": "#5B6078",
      "$description": "Gem highlight."
    },
    "navy-300": {
      "$value": "#6E738D",
      "$description": "Lifted on dark."
    },
    "navy-200": {
      "$value": "#939AB7",
      "$description": "Muted on dark."
    },
    "navy-100": {
      "$value": "#B8C0E0",
      "$description": "Soft divider on light."
    },
    "white": {
      "$value": "#CAD3F5"
    },
    "severity-low": {
      "$value": "#a6da95",
      "$description": "Risk severity / status: low \u2014 palette-derived."
    },
    "severity-medium": {
      "$value": "#eed49f",
      "$description": "Risk severity / status: medium \u2014 palette-derived."
    },
    "severity-high": {
      "$value": "#ed8796",
      "$description": "Risk severity / status: high \u2014 palette-derived."
    },
    "status-done": {
      "$value": "#a6da95",
      "$description": "Status: done \u2014 alias of severity-low."
    },
    "status-current": {
      "$value": "#eed49f",
      "$description": "Status: in progress \u2014 alias of severity-medium."
    },
    "status-next": {
      "$value": "#6e738d",
      "$description": "Status: not yet started \u2014 muted neutral."
    }
  },
  "font-family": {
    "$type": "fontFamily",
    "display": {
      "$value": [
        "Noto Sans",
        "Helvetica Neue",
        "Arial",
        "sans-serif"
      ]
    },
    "body": {
      "$value": [
        "Noto Sans",
        "Helvetica Neue",
        "Arial",
        "sans-serif"
      ]
    },
    "mono": {
      "$value": [
        "Noto Sans Mono",
        "ui-monospace",
        "Menlo",
        "monospace"
      ]
    }
  },
  "font-weight": {
    "$type": "fontWeight",
    "light": {
      "$value": 300
    },
    "regular": {
      "$value": 400
    },
    "medium": {
      "$value": 500
    },
    "semibold": {
      "$value": 600
    },
    "bold": {
      "$value": 700
    },
    "black": {
      "$value": 900
    }
  },
  "font-size": {
    "$type": "dimension",
    "$description": "Sizes match the shared 1920x1080 baseline.",
    "display": {
      "$value": "160px"
    },
    "huge": {
      "$value": "120px"
    },
    "slide-title": {
      "$value": "37px"
    },
    "sub": {
      "$value": "44px"
    },
    "body": {
      "$value": "26px"
    },
    "eyebrow": {
      "$value": "18px"
    },
    "footer": {
      "$value": "16px"
    },
    "pgmeta": {
      "$value": "18px"
    },
    "kpi-value": {
      "$value": "120px"
    },
    "kpi-unit": {
      "$value": "40px"
    },
    "kpi-key": {
      "$value": "16px"
    },
    "kpi-delta": {
      "$value": "18px"
    },
    "col-num": {
      "$value": "14px"
    },
    "col-title": {
      "$value": "36px"
    },
    "col-body": {
      "$value": "22px"
    },
    "btn": {
      "$value": "22px"
    },
    "chip": {
      "$value": "16px"
    },
    "bar-label": {
      "$value": "28px"
    },
    "bar-num": {
      "$value": "22px"
    },
    "quote": {
      "$value": "84px"
    },
    "quote-attr": {
      "$value": "20px"
    },
    "bignum": {
      "$value": "320px"
    },
    "agenda-num": {
      "$value": "18px"
    },
    "agenda-t": {
      "$value": "28px"
    },
    "agenda-d": {
      "$value": "20px"
    }
  },
  "slide": {
    "$type": "dimension",
    "width": {
      "$value": "1920px"
    },
    "height": {
      "$value": "1080px"
    },
    "padding-x": {
      "$value": "100px"
    },
    "padding-y-top": {
      "$value": "100px"
    },
    "padding-y-bottom": {
      "$value": "80px"
    }
  }
}
