{
  "$schema": "https://schemas.designtokens.org/draft-2/format.json",
  "$description": "Nord \u2014 Arctic, north-bluish color palette designed for clear and minimal interfaces. Upstream nordtheme/nord (MIT).",
  "color": {
    "$type": "color",
    "accent": {
      "$value": "#88C0D0",
      "$description": "Primary gold \u2014 the only accent. Use sparingly."
    },
    "accent-hover": {
      "$value": "#81A1C1",
      "$description": "Pressed / printed gold."
    },
    "highlight": {
      "$value": "#5E81AC",
      "$description": "Hover / on-dark accent gold."
    },
    "black": {
      "$value": "#2E3440",
      "$description": "Navy-900 \u2014 deepest."
    },
    "ink": {
      "$value": "#ECEFF4",
      "$description": "Body text on dark \u2014 high contrast."
    },
    "chapter-slab": {
      "$value": "#2E3440",
      "$description": "Polar Night nord0 \u2014 deepest contrast band for chapter dividers."
    },
    "graphite": {
      "$value": "#D8DEE9",
      "$description": "Secondary text."
    },
    "steel": {
      "$value": "#81A1C1",
      "$description": "Tertiary / muted labels."
    },
    "silver": {
      "$value": "#4C566A",
      "$description": "Muted text on dark / soft labels."
    },
    "fog": {
      "$value": "#3B4252",
      "$description": "Warm hairlines on light."
    },
    "paper": {
      "$value": "#2E3440",
      "$description": "Warm paper \u2014 page on light."
    },
    "paper-2": {
      "$value": "#3B4252",
      "$description": "Raised surface on light."
    },
    "off-white": {
      "$value": "#ECEFF4",
      "$description": "Body text on dark."
    },
    "off-white-2": {
      "$value": "#D8DEE9",
      "$description": "Muted text on dark."
    },
    "rule-dark": {
      "$value": "#3B4252",
      "$description": "Hairlines on dark."
    },
    "navy-800": {
      "$value": "#2E3440",
      "$description": "Surface on dark."
    },
    "navy-700": {
      "$value": "#3B4252",
      "$description": "Raised surface on dark."
    },
    "navy-600": {
      "$value": "#434C5E",
      "$description": "Gem mid-facet."
    },
    "navy-500": {
      "$value": "#4C566A",
      "$description": "Gem upper-facet."
    },
    "navy-400": {
      "$value": "#4C566A",
      "$description": "Gem highlight."
    },
    "navy-300": {
      "$value": "#D8DEE9",
      "$description": "Lifted on dark."
    },
    "navy-200": {
      "$value": "#4C566A",
      "$description": "Muted on dark."
    },
    "navy-100": {
      "$value": "#D8DEE9",
      "$description": "Soft divider on light."
    },
    "white": {
      "$value": "#ECEFF4"
    },
    "severity-low": {
      "$value": "#a3be8c",
      "$description": "Risk severity / status: low \u2014 palette-derived."
    },
    "severity-medium": {
      "$value": "#ebcb8b",
      "$description": "Risk severity / status: medium \u2014 palette-derived."
    },
    "severity-high": {
      "$value": "#bf616a",
      "$description": "Risk severity / status: high \u2014 palette-derived."
    },
    "status-done": {
      "$value": "#a3be8c",
      "$description": "Status: done \u2014 alias of severity-low."
    },
    "status-current": {
      "$value": "#ebcb8b",
      "$description": "Status: in progress \u2014 alias of severity-medium."
    },
    "status-next": {
      "$value": "#4c566a",
      "$description": "Status: not yet started \u2014 muted neutral."
    }
  },
  "font-family": {
    "$type": "fontFamily",
    "display": {
      "$value": [
        "Noto Sans",
        "Helvetica Neue",
        "Arial",
        "sans-serif"
      ]
    },
    "body": {
      "$value": [
        "Noto Sans",
        "Helvetica Neue",
        "Arial",
        "sans-serif"
      ]
    },
    "mono": {
      "$value": [
        "Noto Sans Mono",
        "ui-monospace",
        "Menlo",
        "monospace"
      ]
    }
  },
  "font-weight": {
    "$type": "fontWeight",
    "light": {
      "$value": 300
    },
    "regular": {
      "$value": 400
    },
    "medium": {
      "$value": 500
    },
    "semibold": {
      "$value": 600
    },
    "bold": {
      "$value": 700
    },
    "black": {
      "$value": 900
    }
  },
  "font-size": {
    "$type": "dimension",
    "$description": "Sizes match the shared 1920x1080 baseline.",
    "display": {
      "$value": "160px"
    },
    "huge": {
      "$value": "120px"
    },
    "slide-title": {
      "$value": "37px"
    },
    "sub": {
      "$value": "44px"
    },
    "body": {
      "$value": "26px"
    },
    "eyebrow": {
      "$value": "18px"
    },
    "footer": {
      "$value": "16px"
    },
    "pgmeta": {
      "$value": "18px"
    },
    "kpi-value": {
      "$value": "120px"
    },
    "kpi-unit": {
      "$value": "40px"
    },
    "kpi-key": {
      "$value": "16px"
    },
    "kpi-delta": {
      "$value": "18px"
    },
    "col-num": {
      "$value": "14px"
    },
    "col-title": {
      "$value": "36px"
    },
    "col-body": {
      "$value": "22px"
    },
    "btn": {
      "$value": "22px"
    },
    "chip": {
      "$value": "16px"
    },
    "bar-label": {
      "$value": "28px"
    },
    "bar-num": {
      "$value": "22px"
    },
    "quote": {
      "$value": "84px"
    },
    "quote-attr": {
      "$value": "20px"
    },
    "bignum": {
      "$value": "320px"
    },
    "agenda-num": {
      "$value": "18px"
    },
    "agenda-t": {
      "$value": "28px"
    },
    "agenda-d": {
      "$value": "20px"
    }
  },
  "slide": {
    "$type": "dimension",
    "width": {
      "$value": "1920px"
    },
    "height": {
      "$value": "1080px"
    },
    "padding-x": {
      "$value": "100px"
    },
    "padding-y-top": {
      "$value": "100px"
    },
    "padding-y-bottom": {
      "$value": "80px"
    }
  },
  "brief_defaults": {
    "verbosity": "concise",
    "image_style": "minimal",
    "frame": "scqa",
    "audience": "developer"
  }
}
